id,customer_id,sdc,time_stamp
1,7,"My self-driving mower isn't working since this morning",2024-01-10 10:05:22
2,22,"My HedgeBot Compact won't turn on.",2025-02-15 10:12:10
3,37,"My AutoMow Mini still keeps turning off while mowing.",2024-10-15 09:45:31
4,23,"My AquaSpray paused mid-cycle for the third time in two days.",2025-03-16 14:30:00 
5,59,"My GrowMaster AI system is causing stress to my plants due to erratic temperature readings.",2025-01-30 10:00:00
6,54,"My SoilSense Lite isn't reporting soil moisture after it rains.",2024-02-15 09:35:00  